<?xml version="1.0" encoding="UTF-8"?>
<musica   xmlns:xsi="http://www.w3.org/2001/XMLSchema-instance"
          xsi:noNamespaceSchemaLocation="4B.xsd">
    <cd titulo="Álbum A" ano="1998" interprete="musico1"/>
    <cd titulo="Álbum B" ano="2005" interprete="musico2"/>
    
    <musico codigo="AA1122">
        <nomeArtistico> Musico Uno</nomeArtistico>
        <tipo>cantautor</tipo>
        <instrumento>Guitarra</instrumento>
    </musico>
    
    <musico codigo="BB233">
        <nomeArtistico>Musico Dos</nomeArtistico>
        <tipo>Solista</tipo>
        <instrumento>Piano</instrumento>
    </musico>
</musica>
